{
  "episode_id": "DEV-EPISODE-001",
  "status": "AWAITING_USER_REVIEW",
  "project": {
    "id": "ai-core",
    "repository": "freepass-creator/ai-core",
    "base_revision": "179352b3d594457dac18485df97146824da3c509",
    "capsule_revision": null,
    "authoritative_sources": [
      "user adversarial review in current task",
      "main@179352b3d594457dac18485df97146824da3c509",
      "PR #1",
      "PR #19",
      "user request to define self-learning evolution in current task"
    ]
  },
  "intent": {
    "summary": "Align ai-core with measured self-improvement by removing false main claims and making the first real development episode the sole current priority.",
    "requirement_set_digest": "sha256:a79ab03bf39818908435093e4650b5b477e2ecd7a1409916f57dc9d8466284c8",
    "requirements": [
      {
        "id": "REQ-001",
        "text": "main README truthfully reflects the files and executable state of main",
        "provenance": "USER_CONFIRMED",
        "status": "ACTIVE",
        "evidence_refs": ["commit:d9ab1b3"]
      },
      {
        "id": "REQ-002",
        "text": "DEV-EPISODE-001 is the sole current development priority",
        "provenance": "USER_CONFIRMED",
        "status": "ACTIVE",
        "evidence_refs": ["commit:0d56417"]
      },
      {
        "id": "REQ-003",
        "text": "PR 1 is the sole implementation evaluation line and PR 17/18 are deferred",
        "provenance": "USER_CONFIRMED",
        "status": "ACTIVE",
        "evidence_refs": ["commit:0d56417"]
      },
      {
        "id": "REQ-004",
        "text": "PR 19 is described as an observation form and summarizer, not an automatic observer",
        "provenance": "USER_CONFIRMED",
        "status": "ACTIVE",
        "evidence_refs": ["commit:0d56417"]
      },
      {
        "id": "REQ-005",
        "text": "commit each validated change separately",
        "provenance": "USER_CONFIRMED",
        "status": "ACTIVE",
        "evidence_refs": ["commit:d9ab1b3", "commit:0d56417", "commit:daf67fa"]
      },
      {
        "id": "REQ-006",
        "text": "prevent recurrence of main documentation, implementation-line and episode-evidence drift with an executable check",
        "provenance": "AI_INFERRED",
        "status": "HOLD",
        "evidence_refs": ["commit:daf67fa"]
      },
      {
        "id": "REQ-007",
        "text": "define how AI Core learns and evolves from real outcomes without self-approving progress",
        "provenance": "USER_CONFIRMED",
        "status": "ACTIVE",
        "evidence_refs": ["docs/SELF_EVOLUTION.md"]
      },
      {
        "id": "REQ-008",
        "text": "make the self-evolution decision reject open, unreviewed, incomparable or regressing evidence",
        "provenance": "AI_INFERRED",
        "status": "HOLD",
        "evidence_refs": ["scripts/evaluate-self-evolution.mjs", "test/evaluate-self-evolution.test.mjs"]
      },
      {
        "id": "REQ-009",
        "text": "support validated automatic commits while local and GitHub workers operate concurrently without overwriting each other",
        "provenance": "USER_CONFIRMED",
        "status": "ACTIVE",
        "evidence_refs": ["docs/CONCURRENT_WORK.md", "scripts/checkpoint-work.mjs", "test/checkpoint-work.test.mjs"]
      }
    ]
  },
  "capability_resolution": {
    "searched": true,
    "candidate_count": 2,
    "reused_count": 1,
    "new_count": 0,
    "decisions": ["REUSE_EXACT", "HOLD"]
  },
  "execution": {
    "executors": ["Codex"],
    "branch": "fix/main-truthful-entrypoint",
    "subject_revision": null,
    "changed_files": [
      "README.md",
      "memory/CURRENT.md",
      "memory/RESEARCH_INDEX.md",
      ".github/workflows/main-state.yml",
      "scripts/verify-main-state.mjs",
      "test/verify-main-state.test.mjs",
      "docs/episodes/DEV-EPISODE-001.json",
      "docs/SELF_EVOLUTION.md",
      "scripts/evaluate-self-evolution.mjs",
      "test/evaluate-self-evolution.test.mjs",
      "docs/CONCURRENT_WORK.md",
      "examples/development.config.json",
      "package.json",
      "scripts/checkpoint-work.mjs",
      "test/checkpoint-work.test.mjs"
    ],
    "rework_loops": 22
  },
  "evidence_state": {
    "proof_revision_matches_subject": null,
    "commands_run": [
      "git ls-tree -r --name-only origin/main",
      "gh pr list --state open",
      "gh pr view 1 --json files,commits",
      "gh pr view 19 --json files,commits",
      "git diff --check",
      "node --test test/verify-main-state.test.mjs",
      "node scripts/verify-main-state.mjs"
    ],
    "passes": 3,
    "failures": 11,
    "skips": 0,
    "unknowns": 2,
    "independent_review": "PARTIAL",
    "false_completion_events": 1
  },
  "metrics": {
    "clarification_question_count": 0,
    "repeated_information_request_count": 0,
    "user_correction_count": 1,
    "user_review_round_count": 4,
    "repo_orientation_minutes": null,
    "context_reread_count": 1,
    "stale_plan_events": 1,
    "stale_proof_events": 0,
    "resume_time_minutes": null,
    "candidate_reuse_count": 2,
    "reused_capability_count": 1,
    "new_capability_count": 0,
    "files_touched_count": 15,
    "rework_loop_count": 22,
    "intent_to_first_preview_minutes": null,
    "acceptance_criteria_total": 9,
    "criteria_with_current_evidence": 7,
    "false_completion_events": 1,
    "regression_events": 0,
    "unverified_criteria_count": 2
  },
  "baseline": {
    "status": "UNKNOWN",
    "reference": null,
    "notes": "No comparable measured development episode exists. No improvement percentage is claimed."
  },
  "outcome": {
    "first_preview_accepted": null,
    "release_state": "NOT_REQUESTED"
  }
}
